{
  "schema_version": "1.0.0",
  "updated_at": "2026-09-27T05:06:38Z",
  "identity": {
    "provider": "Pragmatic Play",
    "title": "Hot Fiesta",
    "slug": "pragmatic-hot-fiesta",
    "provider_game_id": null,
    "release_year": null,
    "demo_url": null,
    "slotcatalog_url": null,
    "official_info_url": "https://cdn.yesplay.bet/assets/documents/pragmatic-play-Hot-Fiesta-rules.pdf"
  },
  "grid": {
    "rows": null,
    "cols": null,
    "rows_min": null,
    "rows_max": null,
    "layout_notes": null
  },
  "win_system": {
    "type": "paylines",
    "payline_count": null,
    "ways_count": null,
    "min_symbols_for_win": null,
    "direction": "left_to_right",
    "notes": "Left-to-right adjacent / paylines per official rules"
  },
  "reel_behavior": {
    "cascades_or_tumbles": {
      "present": false,
      "how_it_works": null
    },
    "respins": {
      "present": false,
      "how_it_works": null
    },
    "expanding_reels": {
      "present": false,
      "how_it_works": null
    },
    "other": []
  },
  "symbols": {
    "wilds": [
      {
        "name": "WILD",
        "behavior": "This symbol is WILD and substitutes for all symbols except for BONUS.\n 5 - 1000 WILD symbol appears on all reels.\n At every spin, all WILDS have a random multiplier of 2x, 3x or 5x. The WILD\n 4 - 250\n multiplier applies to the total win of each payline that it is part of.\n 3 - 50\n If there is more than 1 WILD symbol part of the win of a payline, the\n multipliers of all WILD symbols on that payline are added to each other.",
        "params": {
          "multiplier_values_mentioned": [
            2,
            3,
            5
          ]
        }
      },
      {
        "name": "WILD",
        "behavior": "FREE SPINS RULES\n Before the round starts, a random number of free spins is awarded from 9 to 27.\n On a grid of 3x3 pinatas each will explode and reveal a number of spins. The numbers revealed\n by each pinata are added together and a total is awarded.\n During the FREE SPINS round all WILD symbols that hit remain on the screen until the end of the\n round and change to a new random position on every free spin. The STICKY ROAMING WILDS have a\n random multiplier of 2x, 3x and 5x that apply to the total win of all paylines that they are part of.\n BONUS symbols are not present on the reels during the round.\n Feature cannot be retriggered.\n Special reels are in play during the free spins round.",
        "params": {
          "multiplier_values_mentioned": [
            2,
            3,
            5
          ]
        }
      }
    ],
    "scatters": [],
    "multipliers": [],
    "collectors": [],
    "specials": []
  },
  "bonus_free_spins": {
    "modes": [
      {
        "name": "Free Spins",
        "trigger": null,
        "spins_awarded": null,
        "retrigger": "Feature cannot be retriggered.",
        "sticky_or_persistent_state": "Persistent/sticky state described in effects",
        "progressive_state": null,
        "effects": "Before the round starts, a random number of free spins is awarded from 9 to 27.\n On a grid of 3x3 pinatas each will explode and reveal a number of spins. The numbers revealed\n by each pinata are added together and a total is awarded.\n During the FREE SPINS round all WILD symbols that hit remain on the screen until the end of the\n round and change to a new random position on every free spin. The STICKY ROAMING WILDS have a\n random multiplier of 2x, 3x and 5x that apply to the total win of all paylines that they are part of.\n BONUS symbols are not present on the reels during the round.\n Feature cannot be retriggered.\n Special reels are in play during the free spins round."
      }
    ],
    "notes": null
  },
  "features": [
    {
      "name": "Free Spins",
      "trigger": null,
      "effects": "Before the round starts, a random number of free spins is awarded from 9 to 27.\n On a grid of 3x3 pinatas each will explode and reveal a number of spins. The numbers revealed\n by each pinata are added together and a total is awarded.\n During the FREE SPINS round all WILD symbols that hit remain on the screen until the end of the\n round and change to a new random position on every free spin. The STICKY ROAMING WILDS have a\n random multiplier of 2x, 3x and 5x that apply to the total win of all paylines that they are part of.\n BONUS symbols are not present on the reels during the round.\n Feature cannot be retriggered.\n Special reels are in play during the free spins round.",
      "params": {}
    },
    {
      "name": "Ante Bet",
      "trigger": null,
      "effects": "The player has the option to increase the bet multiplier to 35x bet per line. When playing with ante\n bet active, the chance to hit BONUS symbols increases.",
      "params": {}
    }
  ],
  "feature_buy": {
    "available": false,
    "options": [],
    "notes": null
  },
  "ante_bet": {
    "available": true,
    "cost_multiplier": null,
    "effects": "The player has the option to increase the bet multiplier to 35x bet per line. When playing with ante\n bet active, the chance to hit BONUS symbols increases.",
    "notes": null
  },
  "numeric_limits": {
    "max_win_multiplier": 5000.0,
    "max_win_notes": "maximum win amount is limited to 5,000x bet",
    "rtp_percent": 94.73,
    "rtp_notes": "From official rules PDF: theoretical RTP 94.73%",
    "hit_frequency_notes": null
  },
  "confidence": {
    "overall": "high",
    "grid": "medium",
    "win_system": "high",
    "reel_behavior": "medium",
    "symbols": "high",
    "bonus_free_spins": "high",
    "features": "high",
    "feature_buy": "low",
    "numeric_limits": "high"
  },
  "evidence": [
    {
      "source_type": "official_pdf",
      "url": "https://cdn.yesplay.bet/assets/documents/pragmatic-play-Hot-Fiesta-rules.pdf",
      "local_path": "sources/pragmatic/pdfs/Hot-Fiesta.pdf",
      "extracted_at": "2026-09-27T05:06:38Z",
      "quote_or_excerpt": "GAME RULES\n All symbols pay from left to right on adjacent reels starting from the leftmost reel.\n\n 5 - 750 5 - 500 5 - 300 5 - 200 5 - 150 5 - 100\n 4 - 150 4 - 100 4 - 60 4 - 40 4 - 25 4 - 20\n 3 - 50 3 - 35 3 - 25 3 - 20 3 - 12 3-8\n\n 5 - 50 5 - 50 5 - 25 5 - 25 5 - 25\n 4 - 10 4 - 10 4-5 4-5 4-5\n 3-5 3-5 3-2 3-2 3-2\n\n This symbol is WILD and substitutes for all symbols except for BONUS.\n 5 - 1000 WILD symbol appears on all reels.\n At every spin, all WILDS have a random multiplier of 2x, 3x or 5x. The WILD\n 4 - 250\n multiplier applies to the total win of each payline that it is part of.\n 3 - 50\n If there is more than 1 WILD symbol part of the win of a payline, the\n multipliers of all WILD sym"
    }
  ],
  "unknowns": [
    "ante_bet.cost_multiplier",
    "grid.rows/cols"
  ]
}
