{
  "schema_version": "1.0.0",
  "updated_at": "2026-09-27T05:02:21Z",
  "identity": {
    "provider": "Pragmatic Play",
    "title": "Empty the Bank",
    "slug": "pragmatic-empty-the-bank",
    "provider_game_id": null,
    "release_year": 2021,
    "demo_url": null,
    "slotcatalog_url": "https://slotcatalog.com/en/slots/Empty-the-Bank",
    "official_info_url": null
  },
  "grid": {
    "rows": 4,
    "cols": 5,
    "rows_min": null,
    "rows_max": null,
    "layout_notes": "SlotCatalog Layout: 5-4"
  },
  "win_system": {
    "type": "paylines",
    "payline_count": 20,
    "ways_count": null,
    "min_symbols_for_win": null,
    "direction": "left_to_right",
    "notes": "SlotCatalog betways: 20"
  },
  "reel_behavior": {
    "cascades_or_tumbles": {
      "present": null,
      "how_it_works": null
    },
    "respins": {
      "present": true,
      "how_it_works": "Respins tagged on SlotCatalog."
    },
    "expanding_reels": {
      "present": null,
      "how_it_works": null
    },
    "other": []
  },
  "symbols": {
    "wilds": [],
    "scatters": [],
    "multipliers": [],
    "collectors": [],
    "specials": []
  },
  "bonus_free_spins": {
    "modes": [],
    "notes": "Secondary source only (SlotCatalog tags/review). Prefer official rules for production use."
  },
  "features": [
    {
      "name": "Bonus Bet",
      "trigger": null,
      "effects": "Listed on SlotCatalog feature tags; detailed trigger/effect text not fully verified from official rules.",
      "params": {}
    },
    {
      "name": "Bonus Game",
      "trigger": null,
      "effects": "Listed on SlotCatalog feature tags; detailed trigger/effect text not fully verified from official rules.",
      "params": {}
    },
    {
      "name": "Bonus symbols",
      "trigger": null,
      "effects": "Listed on SlotCatalog feature tags; detailed trigger/effect text not fully verified from official rules.",
      "params": {}
    },
    {
      "name": "Buy Feature",
      "trigger": null,
      "effects": "Listed on SlotCatalog feature tags; detailed trigger/effect text not fully verified from official rules.",
      "params": {}
    },
    {
      "name": "Hold and Win",
      "trigger": null,
      "effects": "Listed on SlotCatalog feature tags; detailed trigger/effect text not fully verified from official rules.",
      "params": {}
    },
    {
      "name": "Multiplier",
      "trigger": null,
      "effects": "Listed on SlotCatalog feature tags; detailed trigger/effect text not fully verified from official rules.",
      "params": {}
    },
    {
      "name": "Respins",
      "trigger": null,
      "effects": "Listed on SlotCatalog feature tags; detailed trigger/effect text not fully verified from official rules.",
      "params": {}
    },
    {
      "name": "RTP range",
      "trigger": null,
      "effects": "Listed on SlotCatalog feature tags; detailed trigger/effect text not fully verified from official rules.",
      "params": {}
    },
    {
      "name": "Wild",
      "trigger": null,
      "effects": "Listed on SlotCatalog feature tags; detailed trigger/effect text not fully verified from official rules.",
      "params": {}
    }
  ],
  "feature_buy": {
    "available": true,
    "options": [],
    "notes": "Buy Feature tagged on SlotCatalog; cost not verified from official rules."
  },
  "ante_bet": {
    "available": true,
    "cost_multiplier": null,
    "effects": null,
    "notes": "Ante/Bonus Bet tagged on SlotCatalog; cost not verified."
  },
  "numeric_limits": {
    "max_win_multiplier": 10000.0,
    "max_win_notes": "SlotCatalog Max Win: x10000.00",
    "rtp_percent": 95.48,
    "rtp_notes": "SlotCatalog RTP tag: 95.48% RTP Ranges!",
    "hit_frequency_notes": null
  },
  "confidence": {
    "overall": "medium",
    "grid": "medium",
    "win_system": "medium",
    "reel_behavior": "low",
    "symbols": "low",
    "bonus_free_spins": "low",
    "features": "medium",
    "feature_buy": "low",
    "numeric_limits": "medium"
  },
  "evidence": [
    {
      "source_type": "slotcatalog",
      "url": "https://slotcatalog.com/en/slots/Empty-the-Bank",
      "local_path": "sources/slotcatalog/Empty-The-Bank.html",
      "extracted_at": "2026-09-27T05:02:21Z",
      "quote_or_excerpt": "Layout:5-4; Betways:20; RTP:95.48% RTP Ranges!; MaxWin:x10000.00; Features:Bonus Bet, Bonus Game, Bonus symbols, Buy Feature, Hold and Win, Multiplier, Respins, RTP range"
    }
  ],
  "unknowns": [
    "bonus_free_spins exact rules",
    "feature_buy.cost_multiplier",
    "symbols details"
  ]
}
