{
  "schema_version": "1.0.0",
  "updated_at": "2026-09-27T05:05:30Z",
  "identity": {
    "provider": "Backseat Gaming",
    "title": "Chocolate Rocket",
    "slug": "backseat-chocolate-rocket",
    "provider_game_id": "1722",
    "release_year": null,
    "demo_url": "https://static-live.hacksawgaming.com/launcher/static-launcher.html?gameid=1722&channel=desktop&language=en&partner=demo&mode=demo&token=123",
    "slotcatalog_url": null,
    "official_info_url": "https://static-live.hacksawgaming.com/1722/1.14.0/gameinfoassets/templates/en-us/en-us-gameinfo.html"
  },
  "grid": {
    "rows": 5,
    "cols": 5,
    "rows_min": null,
    "rows_max": null,
    "layout_notes": null
  },
  "win_system": {
    "type": "paylines",
    "payline_count": 19,
    "ways_count": null,
    "min_symbols_for_win": null,
    "direction": "left_to_right",
    "notes": "WAYS TO WIN\n\n The specified requirements for a winning combination in the base game are also used during bonus features or free spins play unless otherwise stated. Each wager is eligible for all winning combinations unless otherwise stated.\n\n You win if matching symbols appear along one of the following predefined lines on adjacent reels from left to right, starting with the leftmost reel. The number of possible lines in this game is 19. Please consult the paytable for the number of each symbol "
  },
  "reel_behavior": {
    "cascades_or_tumbles": {
      "present": null,
      "how_it_works": null
    },
    "respins": {
      "present": null,
      "how_it_works": null
    },
    "expanding_reels": {
      "present": null,
      "how_it_works": null
    },
    "other": []
  },
  "symbols": {
    "wilds": [
      {
        "name": "WILD ROCKET",
        "behavior": "When the special Wild Rocket symbol lands it reveals a multiplier: 1x, 2x, 3x, 4x, 5x, 6x, 7x, 8x, 9x, 10x and 20x. The multiplier is then multiplied by the number of grid positions covered while expanding to the top of the grid.\n\n All expanded Wild Rocket positions count as WILD symbols and substitute for all paying symbols.\n\n When multiple expanding wild rocket reels participate in the same win line their multipliers are added together.",
        "params": {}
      },
      {
        "name": "CHOCOLATE BLAST Bonus",
        "behavior": "Trigger the CHOCOLATE BLAST bonus with 10 free spins by landing 3 BONUS scatter symbols at the same time in the BASE GAME.\n\n During this bonus game there is an increased chance of landing Wild Rocket symbols!\n\n BONUS scatter symbols are not available during the bonus game.",
        "params": {}
      },
      {
        "name": "WILD ROCKET FESTIVAL Bonus",
        "behavior": "Trigger the WILD ROCKET FESTIVAL bonus with 10 free spins by landing 4 BONUS scatter symbols at the same time in the BASE GAME.\n\n During this bonus game there is an increased chance of landing Wild Rocket symbols! Wild Rocket symbols remain sticky for the duration of the bonus game and reveal a new initial multiplier on each spin.\n\n If a new Wild Rocket symbol lands below an existing one, it replaces it.\n\n BONUS scatter symbols are not available during the bonus game.",
        "params": {}
      }
    ],
    "scatters": [],
    "multipliers": [],
    "collectors": [],
    "specials": []
  },
  "bonus_free_spins": {
    "modes": [],
    "notes": null
  },
  "features": [
    {
      "name": "WILD ROCKET",
      "trigger": null,
      "effects": "When the special Wild Rocket symbol lands it reveals a multiplier: 1x, 2x, 3x, 4x, 5x, 6x, 7x, 8x, 9x, 10x and 20x. The multiplier is then multiplied by the number of grid positions covered while expanding to the top of the grid.\n\n All expanded Wild Rocket positions count as WILD symbols and substitute for all paying symbols.\n\n When multiple expanding wild rocket reels participate in the same win line their multipliers are added together.",
      "params": {}
    },
    {
      "name": "CHOCOLATE BLAST Bonus",
      "trigger": null,
      "effects": "Trigger the CHOCOLATE BLAST bonus with 10 free spins by landing 3 BONUS scatter symbols at the same time in the BASE GAME.\n\n During this bonus game there is an increased chance of landing Wild Rocket symbols!\n\n BONUS scatter symbols are not available during the bonus game.",
      "params": {}
    },
    {
      "name": "WILD ROCKET FESTIVAL Bonus",
      "trigger": null,
      "effects": "Trigger the WILD ROCKET FESTIVAL bonus with 10 free spins by landing 4 BONUS scatter symbols at the same time in the BASE GAME.\n\n During this bonus game there is an increased chance of landing Wild Rocket symbols! Wild Rocket symbols remain sticky for the duration of the bonus game and reveal a new initial multiplier on each spin.\n\n If a new Wild Rocket symbol lands below an existing one, it replaces it.\n\n BONUS scatter symbols are not available during the bonus game.",
      "params": {}
    }
  ],
  "feature_buy": {
    "available": true,
    "options": [
      {
        "name": "mod_bonus_uc",
        "cost_multiplier": null,
        "cost_text": null,
        "effects": null,
        "rtp_when_bought_note": "RTP when buying is template-injected ({featureBuyRtp}) in gameinfo HTML"
      },
      {
        "name": "mod_wild_uc",
        "cost_multiplier": null,
        "cost_text": null,
        "effects": null,
        "rtp_when_bought_note": "RTP when buying is template-injected ({featureBuyRtp}) in gameinfo HTML"
      },
      {
        "name": "bonus_uc",
        "cost_multiplier": null,
        "cost_text": null,
        "effects": null,
        "rtp_when_bought_note": "RTP when buying is template-injected ({featureBuyRtp}) in gameinfo HTML"
      },
      {
        "name": "bonus_2_uc",
        "cost_multiplier": null,
        "cost_text": null,
        "effects": null,
        "rtp_when_bought_note": "RTP when buying is template-injected ({featureBuyRtp}) in gameinfo HTML"
      }
    ],
    "notes": "Bonus buy available per official rules, but cost multipliers are not stated as concrete numbers in the static gameinfo HTML (often runtime-injected)."
  },
  "ante_bet": {
    "available": true,
    "cost_multiplier": null,
    "effects": null,
    "notes": "FeatureSpins/ante-style options referenced in gameinfo; concrete cost multipliers often runtime-injected."
  },
  "numeric_limits": {
    "max_win_multiplier": 12500,
    "max_win_notes": "maximum win in this game is 12,500 times your bet",
    "rtp_percent": null,
    "rtp_notes": null,
    "hit_frequency_notes": "Hit frequency uses template {hitfreq}% in static gameinfo"
  },
  "confidence": {
    "overall": "high",
    "grid": "high",
    "win_system": "high",
    "reel_behavior": "medium",
    "symbols": "high",
    "bonus_free_spins": "low",
    "features": "high",
    "feature_buy": "medium",
    "numeric_limits": "high"
  },
  "evidence": [
    {
      "source_type": "official_gameinfo",
      "url": "https://static-live.hacksawgaming.com/1722/1.14.0/gameinfoassets/templates/en-us/en-us-gameinfo.html",
      "local_path": "sources/backseat/pages/chocolate-rocket/en-us-gameinfo.html",
      "extracted_at": "2026-09-27T05:05:30Z",
      "quote_or_excerpt": "ABOUT THE GAME\n\n Enter a world of chocolate and sweetness! Chocolate Rocket is a 5-reel, 5-row game with paylines with a distinctive expand functionality. When the Wild Rocket symbol lands it reveals a multiplier and flies up to the top of the grid, multiplying its multiplier by the number of grid positions covered.\n\n The maximum win in this game is 12,500 times your bet, and can be achieved in all game modes.\n\n FEATURES\n\n WILD ROCKET\n\n When the special Wild Rocket symbol lands it reveals a multiplier: 1x, 2x, 3x, 4x, 5x, 6x, 7x, 8x, 9x, 10x and 20x. The multiplier is then multiplied by the nu"
    }
  ],
  "unknowns": [
    "ante_bet.cost_multiplier",
    "bonus_free_spins.modes (none clearly extracted)",
    "feature_buy.cost_multiplier",
    "feature_buy.rtp_when_bought",
    "numeric_limits.rtp_percent"
  ]
}
