{
  "schema_version": "1.0.0",
  "updated_at": "2026-09-27T05:06:38Z",
  "identity": {
    "provider": "Pragmatic Play",
    "title": "Wisdom of Athena",
    "slug": "pragmatic-wisdom-of-athena",
    "provider_game_id": null,
    "release_year": null,
    "demo_url": null,
    "slotcatalog_url": null,
    "official_info_url": "https://cdn-sp.kertn.net/assets/cms/App_Data/20e8c524-e223-48de-9382-7401c87cd065/PDFs/GameRules/Pragmatic120/GameRulesEN/Wisdom-of-Athena.pdf"
  },
  "grid": {
    "rows": null,
    "cols": null,
    "rows_min": null,
    "rows_max": null,
    "layout_notes": null
  },
  "win_system": {
    "type": "unknown",
    "payline_count": null,
    "ways_count": null,
    "min_symbols_for_win": null,
    "direction": null,
    "notes": null
  },
  "reel_behavior": {
    "cascades_or_tumbles": {
      "present": false,
      "how_it_works": null
    },
    "respins": {
      "present": false,
      "how_it_works": null
    },
    "expanding_reels": {
      "present": false,
      "how_it_works": null
    },
    "other": []
  },
  "symbols": {
    "wilds": [],
    "scatters": [],
    "multipliers": [],
    "collectors": [],
    "specials": []
  },
  "bonus_free_spins": {
    "modes": [
      {
        "name": "Free Spins",
        "trigger": null,
        "spins_awarded": null,
        "retrigger": "During free game 3+ Scatters retrigger 5 extra free spins\n\nMultiplier:\n\n • Both base game and free game\n • Multipliers on the screen are added up together\n • Accumulative at free game.",
        "sticky_or_persistent_state": null,
        "progressive_state": null,
        "effects": "• 1 special symbol (Multiplier)\n\fGame Information\nScatter:\n\n • Pays on Free Game trigger\n • Appears on both base game and free game\n • Appears at any reel\n • During base game 4+ Scatters trigger free game with 10 free spins\n • During free game 3+ Scatters retrigger 5 extra free spins\n\nMultiplier:\n\n • Both base game and free game\n • Multipliers on the screen are added up together\n • Accumulative at free game. At the end of free spin (including tumbling session) the multipliers on\n the screen are added to the Outer Multiplier. In other words Outer Multiplier goes up by every free\n spin multipliers (even if there is no win at free spin)\n • ◦ Every free spin at the end of the tumbling session is awarded by win multiplied with Outer\n Multiplier\n • ◦ Multiplier possible values: 2, 3, 4, 5, 6, 8, 10, 12, 15, 20, 25, 30, 40, 50, 60, 80, 100, 150, 200, 300, 400,\n\fGame Information\nUnlocking cells:\n\n • Both base game and free game start with the fully locked first row\n • Unlocked positions remain unlocked for the whole free game\n • Need 1 Tumble for unlocking Reel1 top postion.\n • Need 3 more Tumble for unlocking Reel2 top position\n • Need 6 more Tumble for unlocking Reel3 top position\n • Need 9 more Tumble for unlocking Reel4 top position\n • Need 12 more Tumble for unlocking Reel5 top position\n • Need 15 more Tumble for unlocking Reel6 top position\n\f\f\f\f\f\f\f\f\f\f\f\f\f\f\f\f\f\f\fTHANK YOU"
      }
    ],
    "notes": null
  },
  "features": [
    {
      "name": "Free Spins",
      "trigger": null,
      "effects": "• 1 special symbol (Multiplier)\n\fGame Information\nScatter:\n\n • Pays on Free Game trigger\n • Appears on both base game and free game\n • Appears at any reel\n • During base game 4+ Scatters trigger free game with 10 free spins\n • During free game 3+ Scatters retrigger 5 extra free spins\n\nMultiplier:\n\n • Both base game and free game\n • Multipliers on the screen are added up together\n • Accumulative at free game. At the end of free spin (including tumbling session) the multipliers on\n the screen are added to the Outer Multiplier. In other words Outer Multiplier goes up by every free\n spin multipliers (even if there is no win at free spin)\n • ◦ Every free spin at the end of the tumbling session is awarded by win multiplied with Outer\n Multiplier\n • ◦ Multiplier possible values: 2, 3, 4, 5, 6, 8, 10, 12, 15, 20, 25, 30, 40, 50, 60, 80, 100, 150, 200, 300, 400,\n\fGame Information\nUnlocking cells:\n\n • Both base game and free game start with the fully locked first row\n • Unlocked positions remain unlocked for the whole free game\n • Need 1 Tumble for unlocking Reel1 top postion.\n • Need 3 more Tumble for unlocking Reel2 top position\n • Need 6 more Tumble for unlocking Reel3 top position\n • Need 9 more Tumble for unlocking Reel4 top position\n • Need 12 more Tumble for unlocking Reel5 top position\n • Need 15 more Tumble for unlocking Reel6 top position\n\f\f\f\f\f\f\f\f\f\f\f\f\f\f\f\f\f\f\fTHANK YOU",
      "params": {}
    }
  ],
  "feature_buy": {
    "available": false,
    "options": [],
    "notes": null
  },
  "ante_bet": {
    "available": false,
    "cost_multiplier": null,
    "effects": null,
    "notes": null
  },
  "numeric_limits": {
    "max_win_multiplier": null,
    "max_win_notes": null,
    "rtp_percent": null,
    "rtp_notes": null,
    "hit_frequency_notes": null
  },
  "confidence": {
    "overall": "high",
    "grid": "medium",
    "win_system": "low",
    "reel_behavior": "medium",
    "symbols": "medium",
    "bonus_free_spins": "high",
    "features": "high",
    "feature_buy": "low",
    "numeric_limits": "low"
  },
  "evidence": [
    {
      "source_type": "official_pdf",
      "url": "https://cdn-sp.kertn.net/assets/cms/App_Data/20e8c524-e223-48de-9382-7401c87cd065/PDFs/GameRules/Pragmatic120/GameRulesEN/Wisdom-of-Athena.pdf",
      "local_path": "sources/pragmatic/pdfs/Wisdom-of-Athena.pdf",
      "extracted_at": "2026-09-27T05:06:38Z",
      "quote_or_excerpt": "GAME OVERVIEW\n\f\fGame Description (for Players)\n\nGreek Gods descend on the reels to cast their power in Wisdom of Athena™.\n\nPlayed across 5×6 reels, this pay anywhere slot requires at least eight matching\nsymbols to be present anywhere on the reels to trigger a win. These are then removed\nfrom play, triggering a cascade of new symbols to fall from the top of the game board\nand providing more opportunity to create additional wins. Each tumble created helps\nto reveal an extra reel.\n\nIn the exciting free spins round, multipliers that are landed are held throughout the 10\nspins awarded, with the game offering the possibility of more than one multiplier to be\nadded and increasing the amount won. H"
    }
  ],
  "unknowns": [
    "grid.rows/cols",
    "numeric_limits.max_win_multiplier",
    "numeric_limits.rtp_percent",
    "win_system.type"
  ]
}
