{
  "schema_version": "1.0.0",
  "updated_at": "2026-09-27T05:00:55Z",
  "identity": {
    "provider": "Pragmatic Play",
    "title": "Animal Magic 1000",
    "slug": "pragmatic-animal-magic-1000",
    "provider_game_id": null,
    "release_year": 2024,
    "demo_url": null,
    "slotcatalog_url": "https://slotcatalog.com/en/slots/animal-magic-1000",
    "official_info_url": null
  },
  "grid": {
    "rows": 5,
    "cols": 6,
    "rows_min": null,
    "rows_max": null,
    "layout_notes": "SlotCatalog Layout: 6-5"
  },
  "win_system": {
    "type": "pay_anywhere",
    "payline_count": null,
    "ways_count": null,
    "min_symbols_for_win": null,
    "direction": "anywhere",
    "notes": "Inferred from SlotCatalog tags/text (pay anywhere / scatter pays)"
  },
  "reel_behavior": {
    "cascades_or_tumbles": {
      "present": true,
      "how_it_works": "Cascades/Tumbles tagged on SlotCatalog."
    },
    "respins": {
      "present": null,
      "how_it_works": null
    },
    "expanding_reels": {
      "present": null,
      "how_it_works": null
    },
    "other": []
  },
  "symbols": {
    "wilds": [],
    "scatters": [],
    "multipliers": [],
    "collectors": [],
    "specials": []
  },
  "bonus_free_spins": {
    "modes": [
      {
        "name": "Free Spins",
        "trigger": null,
        "spins_awarded": null,
        "retrigger": null,
        "sticky_or_persistent_state": null,
        "progressive_state": null,
        "effects": "Free Spins tagged on SlotCatalog; exact rules not taken from official paytable in this record."
      }
    ],
    "notes": "Secondary source only (SlotCatalog tags/review). Prefer official rules for production use."
  },
  "features": [
    {
      "name": "Slots by feature",
      "trigger": null,
      "effects": "Listed on SlotCatalog feature tags; detailed trigger/effect text not fully verified from official rules.",
      "params": {}
    },
    {
      "name": "Additional Free Spins",
      "trigger": null,
      "effects": "Listed on SlotCatalog feature tags; detailed trigger/effect text not fully verified from official rules.",
      "params": {}
    },
    {
      "name": "Avalanche",
      "trigger": null,
      "effects": "Listed on SlotCatalog feature tags; detailed trigger/effect text not fully verified from official rules.",
      "params": {}
    },
    {
      "name": "Bonus Bet",
      "trigger": null,
      "effects": "Listed on SlotCatalog feature tags; detailed trigger/effect text not fully verified from official rules.",
      "params": {}
    },
    {
      "name": "Buy Feature",
      "trigger": null,
      "effects": "Listed on SlotCatalog feature tags; detailed trigger/effect text not fully verified from official rules.",
      "params": {}
    },
    {
      "name": "Cascading",
      "trigger": null,
      "effects": "Listed on SlotCatalog feature tags; detailed trigger/effect text not fully verified from official rules.",
      "params": {}
    },
    {
      "name": "Free Spins",
      "trigger": null,
      "effects": "Listed on SlotCatalog feature tags; detailed trigger/effect text not fully verified from official rules.",
      "params": {}
    },
    {
      "name": "Pay Anywhere",
      "trigger": null,
      "effects": "Listed on SlotCatalog feature tags; detailed trigger/effect text not fully verified from official rules.",
      "params": {}
    },
    {
      "name": "Scatter symbols",
      "trigger": null,
      "effects": "Listed on SlotCatalog feature tags; detailed trigger/effect text not fully verified from official rules.",
      "params": {}
    },
    {
      "name": "Wild",
      "trigger": null,
      "effects": "Listed on SlotCatalog feature tags; detailed trigger/effect text not fully verified from official rules.",
      "params": {}
    },
    {
      "name": "Wilds with multipliers",
      "trigger": null,
      "effects": "Listed on SlotCatalog feature tags; detailed trigger/effect text not fully verified from official rules.",
      "params": {}
    }
  ],
  "feature_buy": {
    "available": true,
    "options": [],
    "notes": "Buy Feature tagged on SlotCatalog; cost not verified from official rules."
  },
  "ante_bet": {
    "available": true,
    "cost_multiplier": null,
    "effects": null,
    "notes": "Ante/Bonus Bet tagged on SlotCatalog; cost not verified."
  },
  "numeric_limits": {
    "max_win_multiplier": 5000.0,
    "max_win_notes": "SlotCatalog Max Win: x5000.00",
    "rtp_percent": 96.5,
    "rtp_notes": "SlotCatalog RTP tag: 96.5%",
    "hit_frequency_notes": null
  },
  "confidence": {
    "overall": "medium",
    "grid": "medium",
    "win_system": "medium",
    "reel_behavior": "low",
    "symbols": "low",
    "bonus_free_spins": "low",
    "features": "medium",
    "feature_buy": "low",
    "numeric_limits": "medium"
  },
  "evidence": [
    {
      "source_type": "slotcatalog",
      "url": "https://slotcatalog.com/en/slots/animal-magic-1000",
      "local_path": "sources/slotcatalog/Animal-Magic-1000.html",
      "extracted_at": "2026-09-27T05:00:55Z",
      "quote_or_excerpt": "Layout:6-5; Betways:Pay anywhere; RTP:96.5%; MaxWin:x5000.00; Features:Slots by feature, Additional Free Spins, Avalanche, Bonus Bet, Buy Feature, Cascading, Free Spins, Pay Anywhere"
    }
  ],
  "unknowns": [
    "bonus_free_spins exact rules",
    "feature_buy.cost_multiplier",
    "symbols details"
  ]
}
