{
  "schema_version": "1.0.0",
  "updated_at": "2026-09-27T05:06:38Z",
  "identity": {
    "provider": "Pragmatic Play",
    "title": "Candy Blitz Bombs",
    "slug": "pragmatic-candy-blitz-bombs",
    "provider_game_id": null,
    "release_year": null,
    "demo_url": null,
    "slotcatalog_url": null,
    "official_info_url": "https://cdn.yesplay.bet/assets/documents/pragmatic-play-Candy-Blitz-Bombs-rules.pdf"
  },
  "grid": {
    "rows": null,
    "cols": null,
    "rows_min": null,
    "rows_max": null,
    "layout_notes": null
  },
  "win_system": {
    "type": "pay_anywhere",
    "payline_count": null,
    "ways_count": null,
    "min_symbols_for_win": 8,
    "direction": "anywhere",
    "notes": "Symbols pay anywhere per official GAME RULES"
  },
  "reel_behavior": {
    "cascades_or_tumbles": {
      "present": true,
      "how_it_works": "TUMBLE FEATURE\n The TUMBLE FEATURE means that after every spin, winning combinations are paid and all winning\n symbols disappear. The remaining symbols fall to the bottom of the screen and the empty positions\n are replaced with new symbols coming from above.\n Tumbling will continue until no more winning combinations appear as a result of a tumble.\n All wins are added to the player's balance after all the tumbles resulted from a base spin have been played."
    },
    "respins": {
      "present": false,
      "how_it_works": null
    },
    "expanding_reels": {
      "present": false,
      "how_it_works": null
    },
    "other": []
  },
  "symbols": {
    "wilds": [],
    "scatters": [
      {
        "name": "SCATTER",
        "behavior": "This is the SCATTER symbol.\n SCATTER symbol appears on all reels.",
        "params": {}
      },
      {
        "name": "SCATTER",
        "behavior": "FREE SPINS\n Hit 4, 5 or 6 SCATTER symbols to trigger the FREE SPINS feature and win 10, 12 or 14 free spins respectively.\n During the FREE SPINS round, the multipliers on the multiplier reel are not reset between free spins and\n continue to grow by x1 after every tumble until the end of the round. If BOMB symbols hit during the round,\n their multiplier is added to the current progress.\n Hit 3 or more SCATTER symbols during the round to retrigger the feature and win 5 additional free spins.\n Special reels are in play during the feature.",
        "params": {}
      }
    ],
    "multipliers": [],
    "collectors": [],
    "specials": []
  },
  "bonus_free_spins": {
    "modes": [
      {
        "name": "Free Spins",
        "trigger": "Hit 4, 5 or 6 SCATTER symbols to trigger the FREE SPINS feature and win 10, 12 or 14 free spins respectively.",
        "spins_awarded": null,
        "retrigger": "R symbols during the round to retrigger the feature and win 5 additional free spins.",
        "sticky_or_persistent_state": "Persistent/sticky state described in effects",
        "progressive_state": null,
        "effects": "Hit 4, 5 or 6 SCATTER symbols to trigger the FREE SPINS feature and win 10, 12 or 14 free spins respectively.\n During the FREE SPINS round, the multipliers on the multiplier reel are not reset between free spins and\n continue to grow by x1 after every tumble until the end of the round. If BOMB symbols hit during the round,\n their multiplier is added to the current progress.\n Hit 3 or more SCATTER symbols during the round to retrigger the feature and win 5 additional free spins.\n Special reels are in play during the feature."
      }
    ],
    "notes": null
  },
  "features": [
    {
      "name": "Free Spins",
      "trigger": "Hit 4, 5 or 6 SCATTER symbols to trigger the FREE SPINS feature and win 10, 12 or 14 free spins respectively.",
      "effects": "Hit 4, 5 or 6 SCATTER symbols to trigger the FREE SPINS feature and win 10, 12 or 14 free spins respectively.\n During the FREE SPINS round, the multipliers on the multiplier reel are not reset between free spins and\n continue to grow by x1 after every tumble until the end of the round. If BOMB symbols hit during the round,\n their multiplier is added to the current progress.\n Hit 3 or more SCATTER symbols during the round to retrigger the feature and win 5 additional free spins.\n Special reels are in play during the feature.",
      "params": {}
    },
    {
      "name": "Tumble Feature",
      "trigger": null,
      "effects": "The TUMBLE FEATURE means that after every spin, winning combinations are paid and all winning\n symbols disappear. The remaining symbols fall to the bottom of the screen and the empty positions\n are replaced with new symbols coming from above.\n Tumbling will continue until no more winning combinations appear as a result of a tumble.\n All wins are added to the player's balance after all the tumbles resulted from a base spin have been played.\n\n MULTIPLIER REEL\n An extra reel showing multipliers is present in the game. For every spin, the multiplier starts from x1 and after\n every tumble, it increases by x1. All wins in the game are multiplied by the middle multiplier from this reel. After\n every spin and all tumbles resulted from it, the multipliers on this reel are reset.\n This is the BOMB symbol. It can hit anywhere on the screen.\n Whenever it hits, it carries a random multiplier value that is\n added to the current value on the multiplier reel.\n Possible mutlipliers on the BOMB symbols are: x3, x4, x5, x6, x8, x10, x12, x15, x20, x25, x50, x100 or x500.",
      "params": {}
    },
    {
      "name": "Buy Free Spins",
      "trigger": null,
      "effects": "The FREE SPINS ROUND can be instantly triggered from the base game by buying it for 100x current total bet.\n When buying the free spins round 4, 5 or 6 SCATTERS are guaranteed to hit randomly on the triggering spin.",
      "params": {}
    }
  ],
  "feature_buy": {
    "available": true,
    "options": [
      {
        "name": "Buy Free Spins",
        "cost_multiplier": 100.0,
        "cost_text": "buying it for 100x",
        "effects": "The FREE SPINS ROUND can be instantly triggered from the base game by buying it for 100x current total bet.\n When buying the free spins round 4, 5 or 6 SCATTERS are guaranteed to hit randomly on the triggering spin.",
        "rtp_when_bought_note": null
      }
    ],
    "notes": null
  },
  "ante_bet": {
    "available": false,
    "cost_multiplier": null,
    "effects": null,
    "notes": null
  },
  "numeric_limits": {
    "max_win_multiplier": 5000.0,
    "max_win_notes": "maximum win amount is limited to 5,000x bet",
    "rtp_percent": 96.49,
    "rtp_notes": "From official rules PDF: theoretical RTP 96.49%",
    "hit_frequency_notes": null
  },
  "confidence": {
    "overall": "high",
    "grid": "medium",
    "win_system": "high",
    "reel_behavior": "high",
    "symbols": "high",
    "bonus_free_spins": "high",
    "features": "high",
    "feature_buy": "high",
    "numeric_limits": "high"
  },
  "evidence": [
    {
      "source_type": "official_pdf",
      "url": "https://cdn.yesplay.bet/assets/documents/pragmatic-play-Candy-Blitz-Bombs-rules.pdf",
      "local_path": "sources/pragmatic/pdfs/Candy-Blitz-Bombs.pdf",
      "extracted_at": "2026-09-27T05:06:38Z",
      "quote_or_excerpt": "GAME RULES\n Symbols pay anywhere on the screen. The total number of the same symbol on the\n screen at the end of a spin determines the value of the win.\n\n 12-30 60 12-30 40 12-30 30 12-30 24 12-30 20\n 10-11 30 10-11 20 10-11 16 10-11 14 10-11 12\n 8-9 12 8-9 10 8-9 8 8-9 7 8-9 6\n\n 12-30 16 12-30 14 12-30 10 12-30 8\n 10-11 10 10-11 8 10-11 6 10-11 4\n 8-9 5 8-9 4 8-9 3 8-9 2\n\n This is the SCATTER symbol.\n SCATTER symbol appears on all reels.\n\n TUMBLE FEATURE\n The TUMBLE FEATURE means that after every spin, winning combinations are paid and all winning\n symbols disappear. The remaining symbols fall to the bottom of the screen and the empty positions\n are replaced with new symbols coming from abo"
    }
  ],
  "unknowns": [
    "grid.rows/cols"
  ]
}
